"Issue.ID","Category","Severity","Source.artifact","Description","Impact","Fix.type","Likely.files.affected","Requires.formula.change.TRUE.FALSE","Test.required.TRUE.FALSE"
"FP-001","release blocker","release blocker","notes/audit/defect_risk_register.csv [DEF-001, DEF-002, DEF-003]","Normalize DESCRIPTION maintainer identity and repository metadata using repository-backed evidence.","Release metadata is not publication-ready and weakens package ownership traceability. | Repository and project-home discovery are weaker than expected for release-grade metadata. | Users and reviewers lack a declared issue-reporting endpoint.","metadata normalization","DESCRIPTION",FALSE,TRUE
"FP-002","documentation blocker","documentation blocker","notes/audit/defect_risk_register.csv [DEF-004, DEF-005]","Add release-facing root documentation files required by the baseline audit.","New users and reviewers lack a primary package overview and install/use guidance. | Change tracking is less auditable during stabilization and release preparation.","root documentation","README.md; NEWS.md",FALSE,TRUE
"FP-003","CI / CRAN blocker","CI / CRAN blocker","notes/dynamic-verification/check_results.txt","Stabilize roxygen-driven NAMESPACE generation and restore missing S3 export declarations so devtools packaging no longer strips the public API.","devtools::check() previously rewrote NAMESPACE and reported missing S3 export tags before hitting the local processx wrapper failure.","roxygen and namespace stabilization","R/gof.R; R/ggof.R; R/preproc.R; R/classes.R; NAMESPACE; man/*.Rd",FALSE,TRUE
"FP-004","documentation blocker","documentation blocker","notes/audit/defect_risk_register.csv [DEF-010]","Add runnable Rd examples for the exported public API where feasible.","Example execution cannot contribute runtime evidence during check-like validation.","Rd example coverage","R/gof.R; R/ggof.R; R/preproc.R; R/alpha.R; R/APFB.R; R/HFB.R; R/beta.R; R/mae.R; R/NSeff.R; R/pbias.R; R/r.R; R/rNSeff.R; R/rsr.R; R/valindex.R; R/wsNSeff.R; man/*.Rd",FALSE,TRUE
"FP-005","compatibility blocker","compatibility blocker","notes/compatibility/compatibility_divergence_register.csv [CA-001, CA-002]","Promote already-supported compatibility aliases to formal wrapper/orchestration arguments without changing existing runtime behavior.","Compatibility-sensitive callers may need argument translation rather than direct signature matching. | Static signature checks may treat wrappers as less directly compatible even though runtime na.rm works through ...","formal compatibility aliases","R/gof.R; R/ggof.R; R/preproc.R; R/alpha.R; R/APFB.R; R/HFB.R; R/beta.R; R/mae.R; R/NSeff.R; R/pbias.R; R/r.R; R/rNSeff.R; R/rsr.R; R/valindex.R; R/wsNSeff.R",FALSE,TRUE
"FP-006","compatibility blocker","compatibility blocker","notes/compatibility/compatibility_divergence_register.csv [CA-003, CA-004, CA-005, CA-006] + notes/audit/defect_risk_register.csv [DEF-007]","Clarify non-exported metric coverage, ggof's tabular contract, APFB indexed-input requirements, and preproc shape limits.","Downstream plotting-oriented expectations may not hold for ggof consumers. | APFB cannot be used as a drop-in wrapper for plain numeric inputs. | preproc is less shape-flexible than several wrapper functions built on gof. | Short or sparse high-flow series can fail deterministically before producing a scalar result. | API compatibility claims are difficult to audit because documentation and namespace evidence disagree.","compatibility documentation alignment","COMPATIBILITY_TRACKER.md; README.md; R/ggof.R; R/preproc.R; R/APFB.R; man/*.Rd",FALSE,TRUE
"FP-007","scientific correctness blocker","scientific correctness blocker","notes/math-validation/scientific_defect_register.csv [SD-001, SD-002, SD-014]","Reduce documented scientific ambiguity for exported KGE-component metrics using repository-recorded provenance.","Formula provenance is not backed by a specific recorded citation, which weakens scientific traceability.","provenance citation cleanup","R/core_metrics.R",FALSE,TRUE
"FP-008","low-priority cleanup","low-priority cleanup","notes/math-validation/scientific_defect_register.csv [SD-003, SD-004, SD-005, SD-006, SD-007, SD-008, SD-009, SD-010, SD-011, SD-012, SD-013, SD-015, SD-016, SD-017, SD-018, SD-019, SD-020, SD-021, SD-022] + notes/math-validation/edge_case_behavior_matrix.csv [cp, d, dr, mae, mape, md, me, mnse, mpe, mse, nrmse, nrmse_sd, nse, pbias, pfactor, rd, rfactor, rmse, rnse, rsr, ssq, ubrmse, ve, wnse, wsnse]","Retain the remaining ambiguous internal-metric citations and direct-metric mismatched-length warning rows as tracked follow-up work.","Remaining provenance ambiguity and direct-metric edge-case warnings still reduce scientific traceability, but they do not currently prove a formula defect in the public API.","tracked follow-up backlog","R/core_metrics.R; inst/REFERENCES.md; notes/math-validation/*",FALSE,FALSE
